{
  "users": [
    {
      "google_id": "test_user_123",
      "email": "test@example.com",
      "name": "Test User"
    }
  ],
  "projects": [
    {
      "name": "Test Medical Device",
      "description": "A test medical device for automated testing",
      "device_type": "Test Device",
      "intended_use": "For testing purposes only",
      "status": "draft",
      "priority": "medium",
      "tags": ["test"],
      "user_email": "test@example.com"
    }
  ],
  "device_classifications": [
    {
      "project_name": "Test Medical Device",
      "device_class": "II",
      "product_code": "ABC",
      "regulatory_pathway": "510k",
      "cfr_sections": ["21 CFR 870.2300"],
      "confidence_score": 0.85,
      "reasoning": "Test classification for automated testing"
    }
  ],
  "predicate_devices": [
    {
      "project_name": "Test Medical Device",
      "k_number": "K123456",
      "device_name": "Test Predicate Device",
      "intended_use": "Test predicate for automated testing",
      "product_code": "ABC",
      "clearance_date": "2023-01-01",
      "confidence_score": 0.80,
      "is_selected": true,
      "comparison_data": {
        "similarities": ["Test similarity"],
        "differences": ["Test difference"],
        "risk_assessment": "low",
        "testing_recommendations": ["Test validation"]
      }
    }
  ],
  "agent_interactions": [
    {
      "project_name": "Test Medical Device",
      "user_email": "test@example.com",
      "agent_action": "device_classification",
      "input_data": {
        "device_description": "Test device"
      },
      "output_data": {
        "device_class": "II",
        "product_code": "ABC"
      },
      "confidence_score": 0.85,
      "reasoning": "Test classification reasoning",
      "execution_time_ms": 1000
    }
  ]
}